"","Reference.Type","Record.Number","Author","Year","Title","Journal","Volume","Issue","Pages","Short.Title","Label","Editor","Book.Title","City","Publisher","Short.Title..A.new.bat..Chiroptera","Date","Number.of.Pages","Academic.Department","University","Advisor","Thesis.Type","Series.Title","Notes","Last.Update.Date","Type.of.Medium","URL","Accession.Number","Series.Editor"
"560"," Journal Article","551","S. C. Woods and R. K. Stucky","1992","Catalogue of the type specimens of fossil vertebrates Denver Museum of Natural History","Proceedings of the Denver Museum of Natural History","3","2","1-12","Catalogue of the type specimens of fossil vertebrates Denver Museum of Natural History","797",NA,NA,NA,NA,NA,NA,NA,NA,NA,NA,NA,NA,NA,NA,NA,NA,NA,NA
"561"," Journal Article","550","R. A. Stirton and V. L. VanderHoof","1933","Osteoborus, a new genus of dogs, and its relations to Borophagus Cope","University of California Publications, Bulletin of the Department of Geological Sciences","23","4","175-182","Osteoborus, a new genus of dogs, and its relations to Borophagus Cope","796",NA,NA,NA,NA,NA,NA,NA,NA,NA,NA,NA,NA,NA,NA,NA,NA,NA,NA
"562"," Journal Article","549","H. J. Cook","1930","New rhinoceroses from the Pliocene of Colorado and Nebraska","Proceedings of the Colorado Museum of Natural History","9","4","44-51","New rhinoceroses from the Pliocene of Colorado and Nebraska","795",NA,NA,NA,NA,NA,NA,NA,NA,NA,NA,NA,NA,NA,NA,NA,NA,NA,NA
"563"," Journal Article","548","H. J. Cook","1927","A new rhinoceros of the genus Teleoceras from Colorado","Proceedings of the Colorado Museum of Natural History","7","1","1-2","A new rhinoceros of the genus Teleoceras from Colorado","794",NA,NA,NA,NA,NA,NA,NA,NA,NA,NA,NA,NA,NA,NA,NA,NA,NA,NA
"564"," Journal Article","547","H. J. Cook","1922b","A Pliocene fauna from Yuma County, Colorado, with notes on the closely related Snake Creek Beds, from Nebraska","Proceedings of the Colorado Museum of Natural History","4","2","1-29","A Pliocene fauna from Yuma County, Colorado, with notes on the closely related Snake Creek Beds, from Nebraska","793",NA,NA,NA,NA,NA,NA,NA,NA,NA,NA,NA,NA,NA,NA,NA,NA,NA,NA
"565"," Journal Article","546","H. J. Cook","1922a","Two new bunomastodonts from Colorado","Proceedings of the Colorado Museum of Natural History","4","1","1-14","Two new bunomastodonts from Colorado","792",NA,NA,NA,NA,NA,NA,NA,NA,NA,NA,NA,NA,NA,NA,NA,NA,NA,NA
"566"," Journal Article","545","R. M. Hunt, Jr. and R. Skolnick","1990","The giant mustelid Megalictis from the early Miocene carnivore dens at Agate Fossil Beds National Monument, Siouix County, Nebraska","Proceedings of the Nebraska Academy of Sciences","100",NA,"60-61","The giant mustelid Megalictis from the early Miocene carnivore dens at Agate Fossil Beds National Monument, Siouix County, Nebraska","791",NA,NA,NA,NA,NA,NA,NA,NA,NA,NA,NA,NA,NA,NA,NA,NA,NA,NA
"567"," Journal Article","544","W. D. Matthew","1904","A complete skeleton of Merycodus","Bulletin of the American Museum of Natural History","20","7","101-129","A complete skeleton of Merycodus","790",NA,NA,NA,NA,NA,NA,NA,NA,NA,NA,NA,NA,NA,NA,NA,NA,NA,NA
"568"," Journal Article","542","W. D. Matthew and H. J. Cook","1909","A Pliocene fanua from western Nebraska","Bulletin of the American Museum of Natural History","26","27","361-414","A Pliocene fanua from western Nebraska","789",NA,NA,NA,NA,NA,NA,NA,NA,NA,NA,NA,NA,NA,NA,NA,NA,NA,NA
"569"," Journal Article","541","W. D. Matthew","1909b","Faunal lists of the Tertiary Mammalia of the west","Bulletin of the United States Geological Survey","361",NA,"91-138","Faunal lists of the Tertiary Mammalia of the west","788",NA,NA,NA,NA,NA,NA,NA,NA,NA,NA,NA,NA,NA,NA,NA,NA,NA,NA
"570"," Journal Article","540","E. D. Cope","1874a","Report on the stratigraphy and Pliocene vertebrate palaeontology of northern Colorado","Bulletin of the United States Geological and Geographical Survey of the Territories","1","1","9-28","Report on the stratigraphy and Pliocene vertebrate palaeontology of northern Colorado","787",NA,NA,NA,NA,NA,NA,NA,NA,NA,NA,NA,NA,NA,NA,NA,NA,NA,NA
"571"," Journal Article","539","E. D. Cope","1873c","[On Menotherium lemurinum, Hypisodus minimus, Hypertragulus calcaratus, Hypertragulus tricostatus, Protohippus, and Procamelus occidentalis]","Proceedings of the Academy of Natural Sciences of Philadelphia","1873",NA,"419-420","[On Menotherium lemurinum, Hypisodus minimus, Hypertragulus calcaratus, Hypertragulus tricostatus, Protohippus, and Procamelus occidentalis]","786",NA,NA,NA,NA,NA,NA,NA,NA,NA,NA,NA,NA,NA,NA,NA,NA,NA,NA
"572"," Journal Article","538","E. D. Cope","1876","On a new genus of Camelidae","Proceedings of the Academy of Natural Sciences of Philadelphia","1876",NA,"144-147","On a new genus of Camelidae","785",NA,NA,NA,NA,NA,NA,NA,NA,NA,NA,NA,NA,NA,NA,NA,NA,NA,NA
"573"," Journal Article","536","C. B. Schultz and L. D. Martin","1972","Two lynx-like cats from the Pliocene and Pleistocene","Bulletin of the University of Nebraska State Museum","9","7","197-203","Two lynx-like cats from the Pliocene and Pleistocene","784",NA,NA,NA,NA,NA,NA,NA,NA,NA,NA,NA,NA,NA,NA,NA,NA,NA,NA
"574"," Journal Article","535","H. F. Osborn","1904","New Miocene rhinoceroses with revision of known species","Bulletin of the American Museum of Natural History","20","27","307-326","New Miocene rhinoceroses with revision of known species","783",NA,NA,NA,NA,NA,NA,NA,NA,NA,NA,NA,NA,NA,NA,NA,NA,NA,NA
"575"," Journal Article","534","E. D. Cope","1873b","On some new extinct Mammalia from the Tertiary of the Plains","Palaeontological Bulletin","14",NA,"1-2","On some new extinct Mammalia from the Tertiary of the Plains","782",NA,NA,NA,NA,NA,NA,NA,NA,NA,NA,NA,NA,NA,NA,NA,NA,NA,NA
"576"," Journal Article","533","M. F. Skinner","1968","A Pliocene chalicothere from Nebraska, and the distribution of chalicotheres in the late Tertiary of North America","American Museum Novitates","2346",NA,"1-24","A Pliocene chalicothere from Nebraska, and the distribution of chalicotheres in the late Tertiary of North America","781",NA,NA,NA,NA,NA,NA,NA,NA,NA,NA,NA,NA,NA,NA,NA,NA,NA,NA
"577"," Journal Article","532","W. J. Holland and O. A. Peterson","1913","The osteology of the Chalicotheroidea; with special reference to a mounted skeleton of Moropus elatus Marsh, now installed in the Carnegie Museum","Memoirs of the Carnegie Museum","3",NA,"189-406","The osteology of the Chalicotheroidea; with special reference to a mounted skeleton of Moropus elatus Marsh, now installed in the Carnegie Museum","780",NA,NA,NA,NA,NA,NA,NA,NA,NA,NA,NA,NA,NA,NA,NA,NA,NA,NA
"578"," Journal Article","531","J. W. Gidley","1907","Revision of the Miocene and Pliocene Equidae of North America","Bulletin of the American Museum of Natural History","23","35","865-934","Revision of the Miocene and Pliocene Equidae of North America","779",NA,NA,NA,NA,NA,NA,NA,NA,NA,NA,NA,NA,NA,NA,NA,NA,NA,NA
"579"," Journal Article","530","H. F. Osborn","1923","New subfamily, generic, and specific stages in the evolution of the Proboscidea","American Museum Novitates","99",NA,"1-4","New subfamily, generic, and specific stages in the evolution of the Proboscidea","778",NA,NA,NA,NA,NA,NA,NA,NA,NA,NA,NA,NA,NA,NA,NA,NA,NA,NA
"580"," Book","529","H. F. Osborn","1936","Proboscidea.  A monograph of the discovery, evolution, migration and extinction of the mastodonts and elephants of the world",NA,NA,NA,NA,"Proboscidea.  A monograph of the discovery, evolution, migration and extinction of the mastodonts and elephants of the world","777",NA,NA,"New York","American Museum Press",NA,NA,"802",NA,NA,NA,NA,NA,NA,NA,NA,NA,NA,NA
"581"," Journal Article","528","C. Frick","1926a","The Hemicyoninae and an American Tertiary bear","Bulletin of the American Museum of Natural History","56","1","1-119","The Hemicyoninae and an American Tertiary bear","776",NA,NA,NA,NA,NA,NA,NA,NA,NA,NA,NA,NA,NA,NA,NA,NA,NA,NA
"582"," Journal Article","527","H. J. Cook","1926","A new gigantic dog from Colorado","Proceedings of the Colorado Museum of Natural History","6","5","29-32","A new gigantic dog from Colorado","775",NA,NA,NA,NA,NA,NA,NA,NA,NA,NA,NA,NA,NA,NA,NA,NA,NA,NA
"583"," Journal Article","526","E. C. Galbreath","1956","Remarks on Cynarctoides acridens from the Miocene of northeastern Colorado","Transactions of the Kansas Academy of Science","59",NA,"373-378","Remarks on Cynarctoides acridens from the Miocene of northeastern Colorado","774",NA,NA,NA,NA,NA,NA,NA,NA,NA,NA,NA,NA,NA,NA,NA,NA,NA,NA
"584"," Journal Article","525","E. D. Cope","1873a","Third notice of extinct Vertebrata from the Tertiary of the Plains","Palaeontological Bulletin","16",NA,"1-8","Third notice of extinct Vertebrata from the Tertiary of the Plains","773",NA,NA,NA,NA,NA,NA,NA,NA,NA,NA,NA,NA,NA,NA,NA,NA,NA,NA
"585"," Book Section","524","R. H. Tedford","1999","Rocks and faunas, Ogallala Group, Pawnee Buttes area, Weld County, Colorado",NA,NA,NA,"31-52","Rocks and faunas, Ogallala Group, Pawnee Buttes area, Weld County, Colorado","772","E. Evanoff, R. W. Graham and R. H. Tedford","The Tertiary record of Weld County, northeastern Colorado",NA,NA,NA,NA,NA,NA,NA,NA,NA,NA,NA,NA,NA,NA,NA,NA
"586"," Journal Article","522","E. C. Galbreath","1984","On Mesogaulus paniensis (Rodentia) from Hemingfordian (middle Miocene) deposits in northeastern Colorado","Carnegie Museum of Natural History, Special Publication","9",NA,"85-89","On Mesogaulus paniensis (Rodentia) from Hemingfordian (middle Miocene) deposits in northeastern Colorado","771",NA,NA,NA,NA,NA,NA,NA,NA,NA,NA,NA,NA,NA,NA,NA,NA,NA,NA
"587"," Journal Article","521","E. L. Troxell","1923","Diplolophus, a new genus of rodents","American Journal of Science","205",NA,"157-159","Diplolophus, a new genus of rodents","770",NA,NA,NA,NA,NA,NA,NA,NA,NA,NA,NA,NA,NA,NA,NA,NA,NA,NA
"588"," Journal Article","520","T. H. V. Rich and P. V. Rich","1971","Brachyerix, a Miocene hedgehog from western North America, with a description of the tympanic regions of Paraechinus and Podogymnura","American Museum Novitates","2477",NA,"1-58","Brachyerix, a Miocene hedgehog from western North America, with a description of the tympanic regions of Paraechinus and Podogymnura","769",NA,NA,NA,NA,NA,NA,NA,NA,NA,NA,NA,NA,NA,NA,NA,NA,NA,NA
"589"," Journal Article","519","R. W. Wilson","1960a","Early Miocene rodents and insectivores from northeastern Colorado","Vertebrata","7",NA,"1-92","Early Miocene rodents and insectivores from northeastern Colorado","768",NA,NA,NA,NA,NA,NA,NA,NA,NA,NA,NA,NA,NA,NA,NA,NA,NA,NA
"590"," Journal Article","518","W. D. Matthew","1902b","A horned rodent from the Colorado Miocene.  With a revision of the mylagauli, beavers, and hares of the American Tertiary","Bulletin of the American Museum of Natural History","16","22","291-310","A horned rodent from the Colorado Miocene.  With a revision of the mylagauli, beavers, and hares of the American Tertiary","767",NA,NA,NA,NA,NA,NA,NA,NA,NA,NA,NA,NA,NA,NA,NA,NA,NA,NA
"591"," Journal Article","517","W. D. Matthew","1902a","New Canidae from the Miocene of Colorado","Bulletin of the American Museum of Natural History","16","21","281-290","New Canidae from the Miocene of Colorado","766",NA,NA,NA,NA,NA,NA,NA,NA,NA,NA,NA,NA,NA,NA,NA,NA,NA,NA
"592"," Journal Article","516","W. D. Matthew","1901","Fossil mammals of the Tertiary of northeastern Colorado","Memoirs of the American Museum of Natural History","1","7","353-447","Fossil mammals of the Tertiary of northeastern Colorado","765",NA,NA,NA,NA,NA,NA,NA,NA,NA,NA,NA,NA,NA,NA,NA,NA,NA,NA
"593"," Journal Article","515","E. C. Galbreath","1953","A contribution to the Tertiary geology and paleontology of northeastern Colorado","Vertebrata","4",NA,"1-120","A contribution to the Tertiary geology and paleontology of northeastern Colorado","764",NA,NA,NA,NA,NA,NA,NA,NA,NA,NA,NA,NA,NA,NA,NA,NA,NA,NA
"594"," Thesis","514","A. Richards","1941","Geology of the Kremmling area, Grand County, Colorado",NA,NA,NA,NA,"Geology of the Kremmling area, Grand County, Colorado","763",NA,NA,"Ann Arbor",NA,NA,NA,"68","Geology","University of Michigan",NA,"Ph. D.",NA,NA,NA,NA,NA,NA,NA
"595"," Journal Article","513","T. S. Lovering","1930","The Granby anticline, Grand County, Colorado","Bulletin of the United States Geological Survey","822","2","71-76","The Granby anticline, Grand County, Colorado","762",NA,NA,NA,NA,NA,NA,NA,NA,NA,NA,NA,NA,NA,NA,NA,NA,NA,NA
"596"," Journal Article","512","G. E. Lewis","1969","Larger fossil mammals and mylagaulid rodents from the Troublesome Formation (Miocene) of Colorado","United States Geological Survey Professional Paper","650-B",NA,"B53-B56","Larger fossil mammals and mylagaulid rodents from the Troublesome Formation (Miocene) of Colorado","761",NA,NA,NA,NA,NA,NA,NA,NA,NA,NA,NA,NA,NA,NA,NA,NA,NA,NA
"597"," Journal Article","511","G. A. Izett and G. E. Lewis","1963","Miocene vertebrates from Middle Park, Colorado","United States Geological Survey Professional Paper","475-B","31","B120-B122","Miocene vertebrates from Middle Park, Colorado","760",NA,NA,NA,NA,NA,NA,NA,NA,NA,NA,NA,NA,NA,NA,NA,NA,NA,NA
"598"," Book Section","510","J. d. l. Montagne and W. C. Barnes","1957","Stratigraphy of the North Park Formation in the North Park area, Colorado",NA,NA,NA,"55-60","Stratigraphy of the North Park Formation in the North Park area, Colorado","759",NA,"Rocky Mountain Association Geologists Guidebook 9th Annual Field Conference, North Park and Middle Park Basins, Colorado",NA,NA,NA,NA,NA,NA,NA,NA,NA,NA,NA,NA,NA,NA,NA,NA
"599"," Journal Article","509","W. J. Hail, Jr. and G. E. Lewis","1960","Probable late Miocene age of the North Park Formation in the North Park area, Colorado","Short Papers in the Geological Sciences, Geological Survey Professional Paper","400-B",NA,"B259-B260","Probable late Miocene age of the North Park Formation in the North Park area, Colorado","758",NA,NA,NA,NA,NA,NA,NA,NA,NA,NA,NA,NA,NA,NA,NA,NA,NA,NA
"600"," Book Section","508","T. S. Kelly and E. B. Lander","1988","Biostratigraphy and correlation of Hemingfordian and Barstovian land mammal assemblages, Caliente Formation, Cuyama Valley area, California",NA,"59",NA,"1-19","Biostratigraphy and correlation of Hemingfordian and Barstovian land mammal assemblages, Caliente Formation, Cuyama Valley area, California","757","W. J. M. Bazeley","Tertiary tectonics and sedimentation in the Cuyama Basin, San Luis Obispo, Santa Barbara, and Ventura Counties, California","Los Angeles","The Pacific Section, Society of Economic Paleontologists and Mineralogists",NA,NA,NA,NA,NA,NA,NA,NA,NA,NA,NA,NA,NA,NA
"601"," Journal Article","507","J. A. Wilson","1939","A new species of dog from the Miocene of Colorado","Contributions from the Museum of Paleontology, University of Michigan","5","12","315-318","A new species of dog from the Miocene of Colorado","756",NA,NA,NA,NA,NA,NA,NA,NA,NA,NA,NA,NA,NA,NA,NA,NA,NA,NA
"602"," Journal Article","506","H. Tobien","1973","On the evolution of mastodonts (Proboscidea, Mammalia).  Part 1; the bunodont trilophodont groups","Notizblatt des Hessischen Landesamtes für Bodenforschung zu Wiesbaden","101",NA,"202-276","On the evolution of mastodonts (Proboscidea, Mammalia).  Part 1; the bunodont trilophodont groups","755",NA,NA,NA,NA,NA,NA,NA,NA,NA,NA,NA,NA,NA,NA,NA,NA,NA,NA
"603"," Journal Article","505","P. O. McGrew","1951","Tertiary stratigraphy and paleontology of south-central Wyoming","Wyoming Geological Association Guide Book","6",NA,"54-57","Tertiary stratigraphy and paleontology of south-central Wyoming","754",NA,NA,NA,NA,NA,NA,NA,NA,NA,NA,NA,NA,NA,NA,NA,NA,NA,NA
"604"," Journal Article","504","O. A. Peterson","1924","Discovery of fossil mammals in the Brown's Park Formation of Moffatt County, Colorado","Annals of Carnegie Museum","15","2-3","299-304","Discovery of fossil mammals in the Brown's Park Formation of Moffatt County, Colorado","753",NA,NA,NA,NA,NA,NA,NA,NA,NA,NA,NA,NA,NA,NA,NA,NA,NA,NA
"605"," Journal Article","503","O. A. Peterson","1928","The Browns Park Formation","Memoirs of the Carnegie Museum","11","2","87-130","The Browns Park Formation","752",NA,NA,NA,NA,NA,NA,NA,NA,NA,NA,NA,NA,NA,NA,NA,NA,NA,NA
"606"," Journal Article","502","J. Munthe","1977","A new species of Gregorymys (Rodentia, Geomyidae) from the Miocene of Colorado","PaleoBios","26",NA,"1-12","A new species of Gregorymys (Rodentia, Geomyidae) from the Miocene of Colorado","751",NA,NA,NA,NA,NA,NA,NA,NA,NA,NA,NA,NA,NA,NA,NA,NA,NA,NA
"607"," Book Section","500","D. A. Winkler","1990","Sedimentary facies and biochronology of the upper Tertiary Ogallala Group, Blanco and Yellowhouse Canyons, Texas Panhandle",NA,NA,NA,"39-55","Sedimentary facies and biochronology of the upper Tertiary Ogallala Group, Blanco and Yellowhouse Canyons, Texas Panhandle","750","T. C. Gustavson","Geologic framework and regional hydrology; Upper Cenozoic Blackwater Draw and Ogallala Formations, Great Plains","Austin","University of Texas at Austin, Bureau of Economic Geology",NA,NA,NA,NA,NA,NA,NA,NA,NA,NA,NA,NA,NA,NA
"608"," Thesis","499","D. A. Winkler","1985","Straigraphy, vertebrate paleontology and depositional history of the Ogallala Group in Blanco and Yellowhouse Canyons, northwestern Texas",NA,NA,NA,NA,"Straigraphy, vertebrate paleontology and depositional history of the Ogallala Group in Blanco and Yellowhouse Canyons, northwestern Texas","749",NA,NA,"Austin",NA,NA,NA,"243",NA,"University of Texas at Austin",NA,"Ph.D.",NA,NA,NA,NA,NA,NA,NA
"609"," Journal Article","498","T. Rothwell","2003","Phylogenetic systematics of North American Pseudaelurus (Carnivora; Felidae)","American Museum Novitates","3403",NA,"1-64","Phylogenetic systematics of North American Pseudaelurus (Carnivora; Felidae)","748",NA,NA,NA,NA,NA,NA,NA,NA,NA,NA,NA,NA,NA,NA,NA,NA,NA,NA
"610"," Journal Article","497","J. E. Mawby","1965","Machairodonts from the late Cenozoic of the Panhandle of Texas","Journal of Mammalogy","46","4","573-587","Machairodonts from the late Cenozoic of the Panhandle of Texas","747",NA,NA,NA,NA,NA,NA,NA,NA,NA,NA,NA,NA,NA,NA,NA,NA,NA,NA
"611"," Journal Article","496","C. S. Johnston","1939a","Preliminary report on the late middle Pliocene, Axtel locality, and the description of a new member of the genus Osteoborus","American Journal of Science","237","12","895-898","Preliminary report on the late middle Pliocene, Axtel locality, and the description of a new member of the genus Osteoborus","746",NA,NA,NA,NA,NA,NA,NA,NA,NA,NA,NA,NA,NA,NA,NA,NA,NA,NA
"612"," Journal Article","495","D. E. Savage","1955a","A survey of various late Cenozoic vertebrate faunas of the Panhandle of Texas.  Part II","University of California Publications in Geological Sciences","31","3","51-74","A survey of various late Cenozoic vertebrate faunas of the Panhandle of Texas.  Part II","745",NA,NA,NA,NA,NA,NA,NA,NA,NA,NA,NA,NA,NA,NA,NA,NA,NA,NA
"613"," Journal Article","494","C. S. Johnston and D. E. Savage","1955","A survey of various late Cenozoic vertebrate faunas of the Panhandle of Texas.  Part I","University of California Publications in Geological Sciences","31","2","27-50","A survey of various late Cenozoic vertebrate faunas of the Panhandle of Texas.  Part I","744",NA,NA,NA,NA,NA,NA,NA,NA,NA,NA,NA,NA,NA,NA,NA,NA,NA,NA
"614"," Journal Article","493","J.-D. Lim, L. D. Martin and R. W. Wilson","2001","A new species of Leptarctus (Carnivora, Mustelidae) from the late Miocene of Texas","Journal of Paleontology","75","5","1043-1046","A new species of Leptarctus (Carnivora, Mustelidae) from the late Miocene of Texas","743",NA,NA,NA,NA,NA,NA,NA,NA,NA,NA,NA,NA,NA,NA,NA,NA,NA,NA
"615"," Journal Article","492","N. J. Czaplewski","1993a","Pizonyx wheeleri Dalquest and Patrick (Mammalia; Chiroptera) from the Miocene of Texas referred to the genus Antrozous H. Allen","Journal of Vertebrate Paleontology","13","3","378-380","Pizonyx wheeleri Dalquest and Patrick (Mammalia; Chiroptera) from the Miocene of Texas referred to the genus Antrozous H. Allen","742",NA,NA,NA,NA,NA,NA,NA,NA,NA,NA,NA,NA,NA,NA,NA,NA,NA,NA
"616"," Journal Article","491","B. J. MacFadden","1977","Magnetic polarity stratigraphy of the Chamita Formation stratotype (Mio-Pliocene) of north-central New Mexico","American Journal of Science","277","7","769-800","Magnetic polarity stratigraphy of the Chamita Formation stratotype (Mio-Pliocene) of north-central New Mexico","741",NA,NA,NA,NA,NA,NA,NA,NA,NA,NA,NA,NA,NA,NA,NA,NA,NA,NA
"617"," Journal Article","490","C. S. Johnston","1939b","A skull of Osteoborus validus from the early middle Pliocene of Texas","Journal of Paleontology","13","5","526-530","A skull of Osteoborus validus from the early middle Pliocene of Texas","740",NA,NA,NA,NA,NA,NA,NA,NA,NA,NA,NA,NA,NA,NA,NA,NA,NA,NA
"618"," Journal Article","489","C. J. Hesse","1940","A Pliocene vertebrate fauna from Higgins, Lipscomb County, Texas","University of Texas Publication, Contributions to Geology","3945","2","671-698","A Pliocene vertebrate fauna from Higgins, Lipscomb County, Texas","739",NA,NA,NA,NA,NA,NA,NA,NA,NA,NA,NA,NA,NA,NA,NA,NA,NA,NA
"619"," Journal Article","488","R. L. Evander","1993","Astrohippus walked on faerie toes","Journal of Vertebrate Paleontology, Supplement","13","3","34A","Astrohippus walked on faerie toes","738",NA,NA,NA,NA,NA,NA,NA,NA,NA,NA,NA,NA,NA,NA,NA,NA,NA,NA
"620"," Journal Article","487","W. D. Matthew and R. A. Stirton","1930b","Osteology and affinities of Borophagus","University of California Publications, Bulletin of the Department of Geological Sciences","19","7","171-216","Osteology and affinities of Borophagus","737",NA,NA,NA,NA,NA,NA,NA,NA,NA,NA,NA,NA,NA,NA,NA,NA,NA,NA
"621"," Journal Article","486","W. W. Dalquest","1986","Lower jaw and dentition of the Hemphillian bear, Agriotherium (Ursidae), with the description of a new species","Journal of Mammalogy","67","4","623-631","Lower jaw and dentition of the Hemphillian bear, Agriotherium (Ursidae), with the description of a new species","736",NA,NA,NA,NA,NA,NA,NA,NA,NA,NA,NA,NA,NA,NA,NA,NA,NA,NA
"622"," Journal Article","485","W. H. Burt","1931","Machaerodus catocopis Cope from the Pliocene of Texas","University of California Publications, Bulletin of the Department of Geological Sciences","20","7","261-292","Machaerodus catocopis Cope from the Pliocene of Texas","735",NA,NA,NA,NA,NA,NA,NA,NA,NA,NA,NA,NA,NA,NA,NA,NA,NA,NA
"623"," Journal Article","484","W. W. Dalquest","1969","Pliocene carnivores of the Coffee Ranch","Bulletin of the Texas Memorial Museum","15",NA,"1-43","Pliocene carnivores of the Coffee Ranch","734",NA,NA,NA,NA,NA,NA,NA,NA,NA,NA,NA,NA,NA,NA,NA,NA,NA,NA
"624"," Journal Article","483","W. W. Dalquest","1964","An unusual ungulate jaw from the Pliocene of Texas","Transactions of the Kansas Academy of Science","66","4","747-749","An unusual ungulate jaw from the Pliocene of Texas","733",NA,NA,NA,NA,NA,NA,NA,NA,NA,NA,NA,NA,NA,NA,NA,NA,NA,NA
"625"," Journal Article","482","R. A. Stirton","1936a","A new ruminant from the Hemphill middle Pliocene of Texas","Journal of Paleontology","10","7","644-647","A new ruminant from the Hemphill middle Pliocene of Texas","732",NA,NA,NA,NA,NA,NA,NA,NA,NA,NA,NA,NA,NA,NA,NA,NA,NA,NA
"626"," Journal Article","481","W. W. Dalquest","1980","Camelidae from the Coffee Ranch local fauna (Hemphillian age) of Texas","Journal of Paleontology","54","1","109-117","Camelidae from the Coffee Ranch local fauna (Hemphillian age) of Texas","731",NA,NA,NA,NA,NA,NA,NA,NA,NA,NA,NA,NA,NA,NA,NA,NA,NA,NA
"627"," Journal Article","480","S. D. Webb","1965","The osteology of Camelops","Bulletin of the Los Angeles County Museum, Science","1",NA,"1-54","The osteology of Camelops","730",NA,NA,NA,NA,NA,NA,NA,NA,NA,NA,NA,NA,NA,NA,NA,NA,NA,NA
"628"," Journal Article","479","W. W. Dalquest and T. J. Donovan","1973","A new three-toed horse (Nannippus) from the late Pliocene of Scurry County, Texas","Journal of Paleontology","47","1","34-45","A new three-toed horse (Nannippus) from the late Pliocene of Scurry County, Texas","729",NA,NA,NA,NA,NA,NA,NA,NA,NA,NA,NA,NA,NA,NA,NA,NA,NA,NA
"629"," Journal Article","478","W. W. Dalquest","1981","Hesperohipparion (Mammalia; Equidae), a new genus of horse from the Hemphillian of North America, with description of a new species","Southwestern Naturalist","25","4","505-512","Hesperohipparion (Mammalia; Equidae), a new genus of horse from the Hemphillian of North America, with description of a new species","728",NA,NA,NA,NA,NA,NA,NA,NA,NA,NA,NA,NA,NA,NA,NA,NA,NA,NA
"630"," Journal Article","477","W. D. Matthew","1932b","A review of the rhinoceroses with a description of Aphelops material from the Pliocene of Texas","University of California Publications, Bulletin of the Department of Geological Sciences","20","12","411-480","A review of the rhinoceroses with a description of Aphelops material from the Pliocene of Texas","727",NA,NA,NA,NA,NA,NA,NA,NA,NA,NA,NA,NA,NA,NA,NA,NA,NA,NA
"631"," Book Section","476","S. D. Webb","1989","Osteology and relationships of Thinobadistes segnis, the first mylodont sloth in North America",NA,NA,NA,"469-532","Osteology and relationships of Thinobadistes segnis, the first mylodont sloth in North America","726","K. H. Redford and J. F. Eisenberg","Advances in Neotropical Mammalogy","Gainesville","Sandhill Crane",NA,NA,NA,NA,NA,NA,NA,NA,NA,NA,NA,NA,NA,NA
"632"," Journal Article","475","J. R. Macdonald","1992","An analysis of the types of 147 names horse species and subspecies","Dakoterra","4",NA,"44-48","An analysis of the types of 147 names horse species and subspecies","725",NA,NA,NA,NA,NA,NA,NA,NA,NA,NA,NA,NA,NA,NA,NA,NA,NA,NA
"633"," Journal Article","474","L. M. Toohey","1992","Horse generic and subgeneric names.  A chronology 1758-1966 Morris F. Skinner","Dakoterra","4",NA,"15-43","Horse generic and subgeneric names.  A chronology 1758-1966 Morris F. Skinner","724",NA,NA,NA,NA,NA,NA,NA,NA,NA,NA,NA,NA,NA,NA,NA,NA,NA,NA
