"","Reference.Type","Record.Number","Author","Year","Title","Journal","Volume","Issue","Pages","Short.Title","Label","Editor","Book.Title","City","Publisher","Short.Title..A.new.bat..Chiroptera","Date","Number.of.Pages","Academic.Department","University","Advisor","Thesis.Type","Series.Title","Notes","Last.Update.Date","Type.of.Medium","URL","Accession.Number","Series.Editor"
"288"," Journal Article","993","E. H. Barbour","1906b","Notice of a new Miocene Rhinoceros, Diceratherium arikarense","Science, New Series","24","624","780-781","Notice of a new Miocene Rhinoceros, Diceratherium arikarense","1071",NA,NA,NA,NA,NA,NA,NA,NA,NA,NA,NA,NA,NA,NA,NA,NA,NA,NA
"289"," Journal Article","992","E. H. Barbour","1906a","Notice of a new fossil rhinoceros from Sioux County, Nebraska","Nebraska Geological Survey","2","4","311-318","Notice of a new fossil rhinoceros from Sioux County, Nebraska","1070",NA,NA,NA,NA,NA,NA,NA,NA,NA,NA,NA,NA,NA,NA,NA,NA,NA,NA
"290"," Journal Article","991","H. E. Wood, II","1927","Some early Tertiary rhinoceroses and hyracodonts","Bulletin of American Paleontology","13","50","1-104","Some early Tertiary rhinoceroses and hyracodonts","1069",NA,NA,NA,NA,NA,NA,NA,NA,NA,NA,NA,NA,NA,NA,NA,NA,NA,NA
"291"," Journal Article","990","H. J. Cook","1908","A new rhinoceros from the lower Miocene of Nebraska","American Naturalist","42","500","543-545","A new rhinoceros from the lower Miocene of Nebraska","1068",NA,NA,NA,NA,NA,NA,NA,NA,NA,NA,NA,NA,NA,NA,NA,NA,NA,NA
"292"," Journal Article","989","O. C. Marsh","1873","Notice of new Tertiary mammals","American Journal of Science and Arts","105","29","407-410","Notice of new Tertiary mammals","1067",NA,NA,NA,NA,NA,NA,NA,NA,NA,NA,NA,NA,NA,NA,NA,NA,NA,NA
"293"," Journal Article","988","O. C. Marsh","1875","Notice of new Tertiary mammals, IV","American Journal of Science and Arts","109","51","239-250","Notice of new Tertiary mammals, IV","1066",NA,NA,NA,NA,NA,NA,NA,NA,NA,NA,NA,NA,NA,NA,NA,NA,NA,NA
"294"," Journal Article","987","H. E. Wood, II","1933","A fossil rhinoceros (Diceratherium armatum Marsh) from Gallatin County, Montana","Proceedings of the United States National Museum","82","7","1-4","A fossil rhinoceros (Diceratherium armatum Marsh) from Gallatin County, Montana","1065",NA,NA,NA,NA,NA,NA,NA,NA,NA,NA,NA,NA,NA,NA,NA,NA,NA,NA
"295"," Journal Article","986","E. D. Cope","1879d","American Aceratheria","American Naturalist","13","5","333-334","American Aceratheria","1064",NA,NA,NA,NA,NA,NA,NA,NA,NA,NA,NA,NA,NA,NA,NA,NA,NA,NA
"296"," Journal Article","985","H. F. Osborn","1898b","The extinct rhinoceroses","Memoirs of the American Museum of Natural History","1","3","75-164","The extinct rhinoceroses","1063",NA,NA,NA,NA,NA,NA,NA,NA,NA,NA,NA,NA,NA,NA,NA,NA,NA,NA
"297"," Journal Article","984","F. A. Lucas","1898","Contributions to paleontology.  2.  A new species of Dinictis (D. major)","American Journal of Science","156","35","399-400","Contributions to paleontology.  2.  A new species of Dinictis (D. major)","1062",NA,NA,NA,NA,NA,NA,NA,NA,NA,NA,NA,NA,NA,NA,NA,NA,NA,NA
"298"," Book","983","D. R. Prothero","2005a","The evolution of North American Rhinoceroses",NA,NA,NA,NA,"The evolution of North American Rhinoceroses","1061",NA,NA,"New York","Cambridge University Press",NA,NA,"224",NA,NA,NA,NA,NA,NA,NA,NA,NA,NA,NA
"299"," Thesis","982","B. E. Bailey","2001","Miocene stratigraphy of the Niobrara River Valley, western Cherry County, Nebraska",NA,NA,NA,NA,"Miocene stratigraphy of the Niobrara River Valley, western Cherry County, Nebraska","1060",NA,NA,"Lincoln",NA,NA,NA,"92","Geosciences","University of Nebraska","R. M. Hunt","M.S.",NA,NA,NA,NA,NA,NA,NA
"300"," Journal Article","981","X. Wang, Z. Qiu and B. Wang","2004","A new leptarctine (Carnivora; Mustelidae) from the early Miocene of the northern Tibetan Plateau; implications for the phylogeny and zoogeography of basal mustelids","Zoological Journal of the Linnean Society","142","3","405-421","A new leptarctine (Carnivora; Mustelidae) from the early Miocene of the northern Tibetan Plateau; implications for the phylogeny and zoogeography of basal mustelids","1059",NA,NA,NA,NA,NA,NA,NA,NA,NA,NA,NA,NA,NA,NA,NA,NA,NA,NA
"301"," Journal Article","980","J.-D. Lim and L. D. Martin","2000","A new primitive leptarctine (Mustelidae) from the North American Miocene","Neues Jahrbuch für Geologie und Paläontologie","2000","10","632-640","A new primitive leptarctine (Mustelidae) from the North American Miocene","1058",NA,NA,NA,NA,NA,NA,NA,NA,NA,NA,NA,NA,NA,NA,NA,NA,NA,NA
"302"," Journal Article","979","W. W. Korth","2004b","Beavers (Rodentia, Castoridae) from the Runningwater Formation (early Miocene, early Hemingfordian) of western Nebraska","Annals of Carnegie Museum","73","2","61-71","Beavers (Rodentia, Castoridae) from the Runningwater Formation (early Miocene, early Hemingfordian) of western Nebraska","1057",NA,NA,NA,NA,NA,NA,NA,NA,NA,NA,NA,NA,NA,NA,NA,NA,NA,NA
"303"," Journal Article","978","E. Douglass","1909c","Dromomeryx, a new genus of American ruminants","Annals of Carnegie Museum","5",NA,"457-479","Dromomeryx, a new genus of American ruminants","1056",NA,NA,NA,NA,NA,NA,NA,NA,NA,NA,NA,NA,NA,NA,NA,NA,NA,NA
"304"," Journal Article","977","E. Douglass","1900","New species of Merycochoerus in Montana.  Part I.","American Journal of Science","160",NA,"428-438","New species of Merycochoerus in Montana.  Part I.","1055",NA,NA,NA,NA,NA,NA,NA,NA,NA,NA,NA,NA,NA,NA,NA,NA,NA,NA
"305"," Journal Article","976","M. C. McKenna","1955","A new species of mylagaulid from the Chalk Cliffs local fauna, Montana","Journal of the Washington Academy of Sciences","45","4","107-110","A new species of mylagaulid from the Chalk Cliffs local fauna, Montana","1054",NA,NA,NA,NA,NA,NA,NA,NA,NA,NA,NA,NA,NA,NA,NA,NA,NA,NA
"306"," Journal Article","975","B. E. Bailey","2004","Biostratigraphy and biochronology of early Arikareean through late Hemingfordian small mammal faunas from the Nebraska panhandle and adjacent areas","Paludicola","4","3","81-113","Biostratigraphy and biochronology of early Arikareean through late Hemingfordian small mammal faunas from the Nebraska panhandle and adjacent areas","1053",NA,NA,NA,NA,NA,NA,NA,NA,NA,NA,NA,NA,NA,NA,NA,NA,NA,NA
"307"," Journal Article","974","K. J. Bartley, C. Mitchell and W. W. Korth","2004","A taphonomic study of Clarendonian (Miocene) Teleoceras (Perissodactyla, Rhinocerotoidea) from the Ogallala Formation northwestern Kansas","Geological Society of America Abstracts with Programs","36","5","65","A taphonomic study of Clarendonian (Miocene) Teleoceras (Perissodactyla, Rhinocerotoidea) from the Ogallala Formation northwestern Kansas","1052",NA,NA,NA,NA,NA,NA,NA,NA,NA,NA,NA,NA,NA,NA,NA,NA,NA,NA
"308"," Journal Article","973","W. W. Korth","2004a","Preliminary determination of the age of the Sappa Creek local fauna, northwestern Kansas","Paludicola","4","4","115-124","Preliminary determination of the age of the Sappa Creek local fauna, northwestern Kansas","1051",NA,NA,NA,NA,NA,NA,NA,NA,NA,NA,NA,NA,NA,NA,NA,NA,NA,NA
"309"," Journal Article","972","W. J. Sinclair","1905","New and imperfectly known rodents and ungulates from the John Day series","University of California Publications, Bulletin of the Department of Geology","4",NA,"132-134","New and imperfectly known rodents and ungulates from the John Day series","1050",NA,NA,NA,NA,NA,NA,NA,NA,NA,NA,NA,NA,NA,NA,NA,NA,NA,NA
"310"," Journal Article","971","O. A. Peterson","1909","A revision of the Entelodontidae","Memoirs of the Carnegie Museum","4","3","41-158","A revision of the Entelodontidae","1049",NA,NA,NA,NA,NA,NA,NA,NA,NA,NA,NA,NA,NA,NA,NA,NA,NA,NA
"311"," Journal Article","970","J. Leidy","1873","Contributions to the extinct vertebrate fauna of the western territories","Report of the United States Geological Survey of the Territories","1",NA,"1-320","Contributions to the extinct vertebrate fauna of the western territories","1048",NA,NA,NA,NA,NA,NA,NA,NA,NA,NA,NA,NA,NA,NA,NA,NA,NA,NA
"312"," Journal Article","969","R. A. Martin, J. G. Honey and P. Peláez-Camponanes","2000","The Meade Basin rodent project; a progress report","Paludicola","3","1","1-32","The Meade Basin rodent project; a progress report","1047",NA,NA,NA,NA,NA,NA,NA,NA,NA,NA,NA,NA,NA,NA,NA,NA,NA,NA
"313"," Journal Article","968","W. W. Korth","2002","Review of the castoroidine beavers (Rodentia, Castoridae) from the Clarendonian (Miocene) of northcentral Nebraska","Paludicola","4","1","15-24","Review of the castoroidine beavers (Rodentia, Castoridae) from the Clarendonian (Miocene) of northcentral Nebraska","1046",NA,NA,NA,NA,NA,NA,NA,NA,NA,NA,NA,NA,NA,NA,NA,NA,NA,NA
"314"," Journal Article","967","M. F. Morea and W. W. Korth","2002","A new eomyid rodent (Mammalia) from the Hemingfordian (early Miocene) of Nevada and its relationship to Eurasian Apeomyinae (Eomyidae)","Paludicola","4","1","10-14","A new eomyid rodent (Mammalia) from the Hemingfordian (early Miocene) of Nevada and its relationship to Eurasian Apeomyinae (Eomyidae)","1045",NA,NA,NA,NA,NA,NA,NA,NA,NA,NA,NA,NA,NA,NA,NA,NA,NA,NA
"315"," Journal Article","966","E. L. Troxell","1920","Entelodonts in the Marsh collection","American Journal of Science","200",NA,"243-255, 361-386, 431-445","Entelodonts in the Marsh collection","1044",NA,NA,NA,NA,NA,NA,NA,NA,NA,NA,NA,NA,NA,NA,NA,NA,NA,NA
"316"," Journal Article","965","S. E. Foss and T. Fremd","1998","A survey of the species of entelodonts (Mammalia, Artiodactyla) of the John Day Basin, Oregon","Dakoterra","5",NA,"63-72","A survey of the species of entelodonts (Mammalia, Artiodactyla) of the John Day Basin, Oregon","1043",NA,NA,NA,NA,NA,NA,NA,NA,NA,NA,NA,NA,NA,NA,NA,NA,NA,NA
"317"," Thesis","964","E. Douglass","1899","The Miocene lake beds of western Montana and descriptions of some new vertebrates from the Loup Fork",NA,NA,NA,NA,"The Miocene lake beds of western Montana and descriptions of some new vertebrates from the Loup Fork","1042",NA,NA,"Missoula",NA,NA,NA,"27",NA,"University of Montana",NA,"M.S.",NA,NA,NA,NA,NA,NA,NA
"318"," Journal Article","963","E. Douglass","1909b","Description of a new species of Procamelus from the upper Miocene of Montana, with notes upon Procamelus madisonius Douglass","Annals of Carnegie Museum","5","159-165",NA,"Description of a new species of Procamelus from the upper Miocene of Montana, with notes upon Procamelus madisonius Douglass","1041",NA,NA,NA,NA,NA,NA,NA,NA,NA,NA,NA,NA,NA,NA,NA,NA,NA,NA
"319"," Journal Article","962","E. Douglass","1901","New species of Merycochoerus in Montana.  Part II","American Journal of Science","161",NA,"73-83","New species of Merycochoerus in Montana.  Part II","1040",NA,NA,NA,NA,NA,NA,NA,NA,NA,NA,NA,NA,NA,NA,NA,NA,NA,NA
"320"," Journal Article","961","W. D. Matthew and C. C. Mook","1933","New fossil mammals from the Deep River Beds of Montana","American Museum Novitates","601",NA,"1-7","New fossil mammals from the Deep River Beds of Montana","1039",NA,NA,NA,NA,NA,NA,NA,NA,NA,NA,NA,NA,NA,NA,NA,NA,NA,NA
"321"," Journal Article","960","W. B. Scott","1893","The mammals of the Deep River Beds","American Naturalist","27","319","659-662","The mammals of the Deep River Beds","1038",NA,NA,NA,NA,NA,NA,NA,NA,NA,NA,NA,NA,NA,NA,NA,NA,NA,NA
"322"," Journal Article","959","E. Douglass","1907b","Some new merycoidodonts","Annals of Carnegie Museum","4",NA,"99-109","Some new merycoidodonts","1037",NA,NA,NA,NA,NA,NA,NA,NA,NA,NA,NA,NA,NA,NA,NA,NA,NA,NA
"323"," Journal Article","958","J. H. Wahlert","1991","The Harrymyinae, a new heteromyid subfamily (Rodentia, Geomorpha), based on cranial and dental morphology of Harrymys Munthe, 1988","American Museum Novitates","3013",NA,"1-23","The Harrymyinae, a new heteromyid subfamily (Rodentia, Geomorpha), based on cranial and dental morphology of Harrymys Munthe, 1988","1036",NA,NA,NA,NA,NA,NA,NA,NA,NA,NA,NA,NA,NA,NA,NA,NA,NA,NA
"324"," Journal Article","957","G. A. Izett and J. D. Obradovich","2001","40Ar/39Ar ages of Miocene tuffs in basin-fill deposits (Santa Fe Group, New Mexico, and Troublesome Formation, Colorado) of the Rio Grande rift system","The Mountain Geologist","38","2","77-86","40Ar/39Ar ages of Miocene tuffs in basin-fill deposits (Santa Fe Group, New Mexico, and Troublesome Formation, Colorado) of the Rio Grande rift system","1035",NA,NA,NA,NA,NA,NA,NA,NA,NA,NA,NA,NA,NA,NA,NA,NA,NA,NA
"325"," Journal Article","956","J. Boellstorff","1978","Chronology of some late Cenozoic deposits from the central United States and the ice ages","Transactions of the Nebraska Academy of Sciences","6",NA,"35-49","Chronology of some late Cenozoic deposits from the central United States and the ice ages","1034",NA,NA,NA,NA,NA,NA,NA,NA,NA,NA,NA,NA,NA,NA,NA,NA,NA,NA
"326"," Journal Article","955","E. D. Cope","1881b","The Rodentia of the American Miocene","American Naturalist","15","7","586-587","The Rodentia of the American Miocene","1033",NA,NA,NA,NA,NA,NA,NA,NA,NA,NA,NA,NA,NA,NA,NA,NA,NA,NA
"327"," Journal Article","954","E. D. Cope","1884c","The Vertebrata of the Tertiary formations of the West.  Book I","Report of the United States Geological Survey of the Territories","3",NA,"1-1009","The Vertebrata of the Tertiary formations of the West.  Book I","1032",NA,NA,NA,NA,NA,NA,NA,NA,NA,NA,NA,NA,NA,NA,NA,NA,NA,NA
"328"," Journal Article","953","E. D. Cope","1881a","On the Nimravidae and Canidae of the Miocene period","Bulletin of the United States Geological and Geographic Survey of the Territories","6",NA,"165-181","On the Nimravidae and Canidae of the Miocene period","1031",NA,NA,NA,NA,NA,NA,NA,NA,NA,NA,NA,NA,NA,NA,NA,NA,NA,NA
"329"," Journal Article","952","E. D. Cope","1879c","On the genera of Felidae and Canidae","Proceedings of the Academy of Natural Sciences of Philadelphia",NA,NA,"168-194","On the genera of Felidae and Canidae","1030",NA,NA,NA,NA,NA,NA,NA,NA,NA,NA,NA,NA,NA,NA,NA,NA,NA,NA
"330"," Journal Article","951","M. R. Thorpe","1922b","Oregon Tertiary Canidae, with descriptions of new forms","American Journal of Science","203","15","162-176","Oregon Tertiary Canidae, with descriptions of new forms","1029",NA,NA,NA,NA,NA,NA,NA,NA,NA,NA,NA,NA,NA,NA,NA,NA,NA,NA
"331"," Journal Article","950","E. D. Cope","1880b","Observations on the faunae of the Miocene Tertiaries of Oregon","Bulletin of the United States Geological and Geographic Survey of the Territories","5","3","55-69","Observations on the faunae of the Miocene Tertiaries of Oregon","1028",NA,NA,NA,NA,NA,NA,NA,NA,NA,NA,NA,NA,NA,NA,NA,NA,NA,NA
"332"," Journal Article","949","E. D. Cope","1879b","Scientific news","American Naturalist","13","12","798a-798b","Scientific news","1027",NA,NA,NA,NA,NA,NA,NA,NA,NA,NA,NA,NA,NA,NA,NA,NA,NA,NA
"333"," Journal Article","948","E. D. Cope","1880a","On the extinct cats of America","American Naturalist","14","12","833-858","On the extinct cats of America","1026",NA,NA,NA,NA,NA,NA,NA,NA,NA,NA,NA,NA,NA,NA,NA,NA,NA,NA
"334"," Journal Article","947","J. C. Merriam","1906","Carnivora from the Tertiary formations of the John Day region","University of California Publications, Bulletin of the Department of Geology","5","1","1-64","Carnivora from the Tertiary formations of the John Day region","1025",NA,NA,NA,NA,NA,NA,NA,NA,NA,NA,NA,NA,NA,NA,NA,NA,NA,NA
"335"," Journal Article","946","R. M. Schoch","1984","The type specimen of Tapiravus validus and ?Tapiravus rarus (Mammalia, Perissodactyla), with a review of the genus, and a new report of Miotapirus (Miotapirus marslandensis Schoch and Prins, new species) from Nebraska","Postilla","195",NA,"1-12","The type specimen of Tapiravus validus and ?Tapiravus rarus (Mammalia, Perissodactyla), with a review of the genus, and a new report of Miotapirus (Miotapirus marslandensis Schoch and Prins, new species) from Nebraska","1024",NA,NA,NA,NA,NA,NA,NA,NA,NA,NA,NA,NA,NA,NA,NA,NA,NA,NA
"336"," Journal Article","945","E. D. Cope","1878c","On some of the characters of the Miocene fauna of Oregon","Proceedings of the American Philosophical Society","18","102","63-78","On some of the characters of the Miocene fauna of Oregon","1023",NA,NA,NA,NA,NA,NA,NA,NA,NA,NA,NA,NA,NA,NA,NA,NA,NA,NA
"337"," Journal Article","944","E. D. Cope","1879a","Second contribution to a knowledge of the Miocene fauna of Oregon","Proceedings of the American Philosophical Society","18","104","370-376","Second contribution to a knowledge of the Miocene fauna of Oregon","1022",NA,NA,NA,NA,NA,NA,NA,NA,NA,NA,NA,NA,NA,NA,NA,NA,NA,NA
"338"," Journal Article","943","H. F. Osborn","1921b","First appearance of the true mastodon in America","American Museum Novitates","10",NA,"1-6","First appearance of the true mastodon in America","1021",NA,NA,NA,NA,NA,NA,NA,NA,NA,NA,NA,NA,NA,NA,NA,NA,NA,NA
"339"," Journal Article","942","G. D. Louderback","1933","Notes on the geologic section near Columbia, California, with special reference to the occurrence of fossils in the Auriferous Gravels","Contributions to Paleontology, Carnegie Institution of Washington","440","2","7-13","Notes on the geologic section near Columbia, California, with special reference to the occurrence of fossils in the Auriferous Gravels","1020",NA,NA,NA,NA,NA,NA,NA,NA,NA,NA,NA,NA,NA,NA,NA,NA,NA,NA
"340"," Journal Article","941","J. C. Merriam and C. Stock","1933","Tertiary mammals from the Auriferous GRavels near Columbia, California","Contributions to Paleontology, Carnegie Institution of Washington","440","1","1-6","Tertiary mammals from the Auriferous GRavels near Columbia, California","1019",NA,NA,NA,NA,NA,NA,NA,NA,NA,NA,NA,NA,NA,NA,NA,NA,NA,NA
"341"," Journal Article","940","B. J. MacFadden, C. C. Swisher, III, N. D. Opdyke and M. O. Woodburne","1990","Paleomagnetism, geochronology, and possible tectonic rotation of the middle Miocene Barstow Formation, Mojave Desert, southern California","Geological Society of America Bulletin","102","4","478-493","Paleomagnetism, geochronology, and possible tectonic rotation of the middle Miocene Barstow Formation, Mojave Desert, southern California","1018",NA,NA,NA,NA,NA,NA,NA,NA,NA,NA,NA,NA,NA,NA,NA,NA,NA,NA
"342"," Book Section","939","E. B. Lander and R. E. Reynolds","1985","Fossil vertebrates from the Calico Mountains area, central Mojave Desert, San Bernardino County, California",NA,NA,NA,"153-156","Fossil vertebrates from the Calico Mountains area, central Mojave Desert, San Bernardino County, California","1017","R. E. c. Reynolds","Geological investigations along Interstate 15, Cajon Pass to Manix Lake, California","Redlands","San Bernardino County Museum",NA,NA,NA,NA,NA,NA,NA,NA,NA,NA,NA,NA,NA,NA
"343"," Journal Article","938","G. E. Lewis","1964","Miocene vertebrates of the Barstow Formation in southern California","United States Geological Survey Professional Paper","475-D","125","D18-D23","Miocene vertebrates of the Barstow Formation in southern California","1016",NA,NA,NA,NA,NA,NA,NA,NA,NA,NA,NA,NA,NA,NA,NA,NA,NA,NA
"344"," Journal Article","937","F. M. Byers, Jr.","1960","Geology of the Avlord Mountain Quadrangle, Sand Bernardino County, California","Geological Survey Bulletin","1089-A",NA,"1-71","Geology of the Avlord Mountain Quadrangle, Sand Bernardino County, California","1015",NA,NA,NA,NA,NA,NA,NA,NA,NA,NA,NA,NA,NA,NA,NA,NA,NA,NA
"345"," Journal Article","936","P. Davidson","1923","Alticamelus alexandrae, a new camel from the Barstow upper Miocene fo the Mohave Desert","University of California Publications, Bulletin of the Department of Geological Sciences","14","12","397-408","Alticamelus alexandrae, a new camel from the Barstow upper Miocene fo the Mohave Desert","1014",NA,NA,NA,NA,NA,NA,NA,NA,NA,NA,NA,NA,NA,NA,NA,NA,NA,NA
"346"," Journal Article","935","J. C. Merriam","1911b","A collection of mammalian remains from Tertiary beds on the Mohave Desert","University of California Publications, Bulletin of the Department of Geology","6","7","167-169","A collection of mammalian remains from Tertiary beds on the Mohave Desert","1013",NA,NA,NA,NA,NA,NA,NA,NA,NA,NA,NA,NA,NA,NA,NA,NA,NA,NA
"347"," Book Section","934","G. E. Schultz","2002","Clarendonian and Hemphillian vertebrate faunas from the Ogallala Formation (late Miocene-early Pliocene) of the Texas panhandle and adjacent Oklahoma",NA,"10",NA,"35-71","Clarendonian and Hemphillian vertebrate faunas from the Ogallala Formation (late Miocene-early Pliocene) of the Texas panhandle and adjacent Oklahoma","1012","D. W. Burbank, N. Czaplewski and R. Lupia","Field trip guidebook; 62nd annual meeting of the Society of Vertebrate Paleontology","Norman","Oklahoma Geological Survey",NA,NA,NA,NA,NA,NA,NA,"Oklahoma Geological Survey Open-File Report",NA,NA,NA,NA,NA,NA
"348"," Journal Article","933","M. O. Woodburne","1991","The Mojave Desert province","San Bernardino County Museum Association Quarterly","38","3","60-77","The Mojave Desert province","1011",NA,NA,NA,NA,NA,NA,NA,NA,NA,NA,NA,NA,NA,NA,NA,NA,NA,NA
"349"," Journal Article","932","J. C. Merriam","1913e","A peculiar horn or antler from the Mohave Miocene of California","University of California Publications, Bulletin of the Department of Geology","7","16","335-339","A peculiar horn or antler from the Mohave Miocene of California","1010",NA,NA,NA,NA,NA,NA,NA,NA,NA,NA,NA,NA,NA,NA,NA,NA,NA,NA
"350"," Book Section","931","R. E. Reynolds and E. B. Lander","1985","Preliminary report on the Miocene Daggett Ridge local fauna, central Mojave Desert, San Bernardino County, California",NA,NA,NA,"105-110","Preliminary report on the Miocene Daggett Ridge local fauna, central Mojave Desert, San Bernardino County, California","1009","R. E. c. Reynolds","Geological investigations along Interstate 15, Cajon Pass to Manix Lake, California","Redlands","San Bernardino County Museum",NA,NA,NA,NA,NA,NA,NA,NA,NA,NA,NA,NA,NA,NA
"351"," Journal Article","930","E. H. Lindsay","1991","Small mammals near the Hemingfordian/Barstovian boundary in the Barstow syncline","San Bernardino County Museum Association Quarterly","38","3","78-79","Small mammals near the Hemingfordian/Barstovian boundary in the Barstow syncline","1008",NA,NA,NA,NA,NA,NA,NA,NA,NA,NA,NA,NA,NA,NA,NA,NA,NA,NA
"352"," Journal Article","929","R. H. Tedford and R. M. Alf","1962","A new Megahippus from the Barstow Formation San Bernardino County, California","Bulletin of the Southern California Academy of Sciences","61","2","113-122","A new Megahippus from the Barstow Formation San Bernardino County, California","1007",NA,NA,NA,NA,NA,NA,NA,NA,NA,NA,NA,NA,NA,NA,NA,NA,NA,NA
"353"," Journal Article","928","A. F. Pajak, III and A. R. Vincelette","1991","""Merychippus"" stylodontus and ""M."" intermontanus; biostratigraphy and basic morphology of two Barstovian tridactyl horses","San Bernardino County Museum Association Quarterly","38","3","80-85","""Merychippus"" stylodontus and ""M."" intermontanus; biostratigraphy and basic morphology of two Barstovian tridactyl horses","1006",NA,NA,NA,NA,NA,NA,NA,NA,NA,NA,NA,NA,NA,NA,NA,NA,NA,NA
"354"," Journal Article","927","C. Stock","1937","A peccary skull from the Barstow Miocene, California","Proceedings of the National Academy of Sciences of the United States of America","23","7","398-404","A peccary skull from the Barstow Miocene, California","1005",NA,NA,NA,NA,NA,NA,NA,NA,NA,NA,NA,NA,NA,NA,NA,NA,NA,NA
"355"," Book Section","926","M. O. Woodburne and R. H. Tedford","1982","Litho- and biostratigraphy of the Barstow Formation, Mjoave Desert. California",NA,NA,NA,"65-76","Litho- and biostratigraphy of the Barstow Formation, Mjoave Desert. California","1004","J. D. Cooper","Guidebook; Geologic excursions in the California desert","Anaheim","Geological Society of America",NA,NA,NA,NA,NA,NA,NA,NA,NA,NA,NA,NA,NA,NA
"356"," Journal Article","925","M. O. Woodburne, R. H. Tedford and C. C. Swisher, III","1990","Lithostratigraphy, biostratigraphy, and geochronology of the Barstow Formation, Mojave Desert, southern California","Geological Society of America Bulletin","102","4","459-477","Lithostratigraphy, biostratigraphy, and geochronology of the Barstow Formation, Mojave Desert, southern California","1003",NA,NA,NA,NA,NA,NA,NA,NA,NA,NA,NA,NA,NA,NA,NA,NA,NA,NA
"357"," Journal Article","924","E. H. Lindsay","1995","Copemys and the Barstovian/Hemingfordian boundary","Journal of Vertebrate Paleontology","15","2","357-365","Copemys and the Barstovian/Hemingfordian boundary","1002",NA,NA,NA,NA,NA,NA,NA,NA,NA,NA,NA,NA,NA,NA,NA,NA,NA,NA
"358"," Journal Article","923","R. A. Stirton","1930","A new genus of Soricidae from the Barstow Miocene of California","University of California Publications, Bulletin of the Department of Geological Sciences","19","8","217-228","A new genus of Soricidae from the Barstow Miocene of California","1001",NA,NA,NA,NA,NA,NA,NA,NA,NA,NA,NA,NA,NA,NA,NA,NA,NA,NA
"359"," Journal Article","922","E. R. Hall","1930e","Rodents and lagomorphs from the Barstow beds of southern California","University of California Publications, Bulletin of the Department of Geological Sciences","19","13","313-318","Rodents and lagomorphs from the Barstow beds of southern California","1000",NA,NA,NA,NA,NA,NA,NA,NA,NA,NA,NA,NA,NA,NA,NA,NA,NA,NA
"360"," Journal Article","921","C. Stock","1928b","A tooth of Hipparion mohavense from the Puente Formation, California","Contributions to Paleontology, Carnegie Institution of Washington","393","6","51-53","A tooth of Hipparion mohavense from the Puente Formation, California","999",NA,NA,NA,NA,NA,NA,NA,NA,NA,NA,NA,NA,NA,NA,NA,NA,NA,NA
"361"," Journal Article","920","D. P. Whistler","1991","Geologic history of the El Paso Mountains region","San Bernardino County Museum Association Quarterly","38","3","108-113","Geologic history of the El Paso Mountains region","998",NA,NA,NA,NA,NA,NA,NA,NA,NA,NA,NA,NA,NA,NA,NA,NA,NA,NA
